{
  "captured_at": "2026-09-03T00:06:00Z",
  "deployments": [
    {
      "ai_bom": {
        "artifact_id": "alpha-ai-bom",
        "document_sha256": "dddddddddddddddddddddddddddddddddddddddddddddddddddddddddddddddd",
        "format": "spdx-3.0.1",
        "subject_artifact_ids": [
          "alpha-container",
          "alpha-model",
          "alpha-policy"
        ]
      },
      "artifacts": [
        {
          "artifact_id": "alpha-ai-bom",
          "media_type": "application/spdx+json",
          "model_embedded_code": false,
          "model_serialization": null,
          "package_url": null,
          "remote_code_required": false,
          "role": "ai_sbom",
          "sha256": "dddddddddddddddddddddddddddddddddddddddddddddddddddddddddddddddd"
        },
        {
          "artifact_id": "alpha-container",
          "media_type": "application/vnd.oci.image.manifest.v1+json",
          "model_embedded_code": false,
          "model_serialization": null,
          "package_url": "pkg:oci/example/lureagent-alpha@sha256:aaaaaaaaaaaaaaaaaaaaaaaaaaaaaaaaaaaaaaaaaaaaaaaaaaaaaaaaaaaaaaaa",
          "remote_code_required": false,
          "role": "container_image",
          "sha256": "aaaaaaaaaaaaaaaaaaaaaaaaaaaaaaaaaaaaaaaaaaaaaaaaaaaaaaaaaaaaaaaa"
        },
        {
          "artifact_id": "alpha-model",
          "media_type": "application/vnd.safetensors",
          "model_embedded_code": false,
          "model_serialization": "safetensors",
          "package_url": "pkg:huggingface/example/model-alpha@0123456789abcdef",
          "remote_code_required": false,
          "role": "model_weights",
          "sha256": "bbbbbbbbbbbbbbbbbbbbbbbbbbbbbbbbbbbbbbbbbbbbbbbbbbbbbbbbbbbbbbbb"
        },
        {
          "artifact_id": "alpha-policy",
          "media_type": "application/vnd.openpolicyagent.bundle",
          "model_embedded_code": false,
          "model_serialization": null,
          "package_url": "pkg:generic/example/alpha-policy@1.0.0",
          "remote_code_required": false,
          "role": "policy_bundle",
          "sha256": "cccccccccccccccccccccccccccccccccccccccccccccccccccccccccccccccc"
        }
      ],
      "attestations": [
        {
          "attestation_id": "alpha-container-provenance",
          "build_type": "https://github.com/actions/runner/build/v1",
          "builder_id": "https://github.com/actions/runner",
          "predicate_type": "https://slsa.dev/provenance/v1",
          "source_sha256": "1111111111111111111111111111111111111111111111111111111111111111",
          "statement_sha256": "eeeeeeeeeeeeeeeeeeeeeeeeeeeeeeeeeeeeeeeeeeeeeeeeeeeeeeeeeeeeeeee",
          "statement_type": "https://in-toto.io/Statement/v1",
          "subject_artifact_id": "alpha-container",
          "subject_sha256": "aaaaaaaaaaaaaaaaaaaaaaaaaaaaaaaaaaaaaaaaaaaaaaaaaaaaaaaaaaaaaaaa"
        },
        {
          "attestation_id": "alpha-model-provenance",
          "build_type": "https://github.com/actions/runner/build/v1",
          "builder_id": "https://github.com/actions/runner",
          "predicate_type": "https://slsa.dev/provenance/v1",
          "source_sha256": "2222222222222222222222222222222222222222222222222222222222222222",
          "statement_sha256": "ffffffffffffffffffffffffffffffffffffffffffffffffffffffffffffffff",
          "statement_type": "https://in-toto.io/Statement/v1",
          "subject_artifact_id": "alpha-model",
          "subject_sha256": "bbbbbbbbbbbbbbbbbbbbbbbbbbbbbbbbbbbbbbbbbbbbbbbbbbbbbbbbbbbbbbbb"
        },
        {
          "attestation_id": "alpha-policy-provenance",
          "build_type": "https://github.com/actions/runner/build/v1",
          "builder_id": "https://github.com/actions/runner",
          "predicate_type": "https://slsa.dev/provenance/v1",
          "source_sha256": "3333333333333333333333333333333333333333333333333333333333333333",
          "statement_sha256": "0000000000000000000000000000000000000000000000000000000000000000",
          "statement_type": "https://in-toto.io/Statement/v1",
          "subject_artifact_id": "alpha-policy",
          "subject_sha256": "cccccccccccccccccccccccccccccccccccccccccccccccccccccccccccccccc"
        }
      ],
      "node_id": "identity-credential-broker",
      "observation_id": "w001-n001",
      "spiffe_id": "spiffe://example.com/agents/alpha",
      "workload_principal_id": "workload-alpha"
    },
    {
      "ai_bom": {
        "artifact_id": "alpha-ai-bom",
        "document_sha256": "dddddddddddddddddddddddddddddddddddddddddddddddddddddddddddddddd",
        "format": "spdx-3.0.1",
        "subject_artifact_ids": [
          "alpha-container",
          "alpha-model",
          "alpha-policy"
        ]
      },
      "artifacts": [
        {
          "artifact_id": "alpha-ai-bom",
          "media_type": "application/spdx+json",
          "model_embedded_code": false,
          "model_serialization": null,
          "package_url": null,
          "remote_code_required": false,
          "role": "ai_sbom",
          "sha256": "dddddddddddddddddddddddddddddddddddddddddddddddddddddddddddddddd"
        },
        {
          "artifact_id": "alpha-container",
          "media_type": "application/vnd.oci.image.manifest.v1+json",
          "model_embedded_code": false,
          "model_serialization": null,
          "package_url": "pkg:oci/example/lureagent-alpha@sha256:aaaaaaaaaaaaaaaaaaaaaaaaaaaaaaaaaaaaaaaaaaaaaaaaaaaaaaaaaaaaaaaa",
          "remote_code_required": false,
          "role": "container_image",
          "sha256": "aaaaaaaaaaaaaaaaaaaaaaaaaaaaaaaaaaaaaaaaaaaaaaaaaaaaaaaaaaaaaaaa"
        },
        {
          "artifact_id": "alpha-model",
          "media_type": "application/vnd.safetensors",
          "model_embedded_code": false,
          "model_serialization": "safetensors",
          "package_url": "pkg:huggingface/example/model-alpha@0123456789abcdef",
          "remote_code_required": false,
          "role": "model_weights",
          "sha256": "bbbbbbbbbbbbbbbbbbbbbbbbbbbbbbbbbbbbbbbbbbbbbbbbbbbbbbbbbbbbbbbb"
        },
        {
          "artifact_id": "alpha-policy",
          "media_type": "application/vnd.openpolicyagent.bundle",
          "model_embedded_code": false,
          "model_serialization": null,
          "package_url": "pkg:generic/example/alpha-policy@1.0.0",
          "remote_code_required": false,
          "role": "policy_bundle",
          "sha256": "cccccccccccccccccccccccccccccccccccccccccccccccccccccccccccccccc"
        }
      ],
      "attestations": [
        {
          "attestation_id": "alpha-container-provenance",
          "build_type": "https://github.com/actions/runner/build/v1",
          "builder_id": "https://github.com/actions/runner",
          "predicate_type": "https://slsa.dev/provenance/v1",
          "source_sha256": "1111111111111111111111111111111111111111111111111111111111111111",
          "statement_sha256": "eeeeeeeeeeeeeeeeeeeeeeeeeeeeeeeeeeeeeeeeeeeeeeeeeeeeeeeeeeeeeeee",
          "statement_type": "https://in-toto.io/Statement/v1",
          "subject_artifact_id": "alpha-container",
          "subject_sha256": "aaaaaaaaaaaaaaaaaaaaaaaaaaaaaaaaaaaaaaaaaaaaaaaaaaaaaaaaaaaaaaaa"
        },
        {
          "attestation_id": "alpha-model-provenance",
          "build_type": "https://github.com/actions/runner/build/v1",
          "builder_id": "https://github.com/actions/runner",
          "predicate_type": "https://slsa.dev/provenance/v1",
          "source_sha256": "2222222222222222222222222222222222222222222222222222222222222222",
          "statement_sha256": "ffffffffffffffffffffffffffffffffffffffffffffffffffffffffffffffff",
          "statement_type": "https://in-toto.io/Statement/v1",
          "subject_artifact_id": "alpha-model",
          "subject_sha256": "bbbbbbbbbbbbbbbbbbbbbbbbbbbbbbbbbbbbbbbbbbbbbbbbbbbbbbbbbbbbbbbb"
        },
        {
          "attestation_id": "alpha-policy-provenance",
          "build_type": "https://github.com/actions/runner/build/v1",
          "builder_id": "https://github.com/actions/runner",
          "predicate_type": "https://slsa.dev/provenance/v1",
          "source_sha256": "3333333333333333333333333333333333333333333333333333333333333333",
          "statement_sha256": "0000000000000000000000000000000000000000000000000000000000000000",
          "statement_type": "https://in-toto.io/Statement/v1",
          "subject_artifact_id": "alpha-policy",
          "subject_sha256": "cccccccccccccccccccccccccccccccccccccccccccccccccccccccccccccccc"
        }
      ],
      "node_id": "identity-policy-gateway",
      "observation_id": "w001-n002",
      "spiffe_id": "spiffe://example.com/agents/alpha",
      "workload_principal_id": "workload-alpha"
    },
    {
      "ai_bom": {
        "artifact_id": "beta-ai-bom",
        "document_sha256": "7777777777777777777777777777777777777777777777777777777777777777",
        "format": "cyclonedx-1.7",
        "subject_artifact_ids": [
          "beta-container",
          "beta-model",
          "beta-policy"
        ]
      },
      "artifacts": [
        {
          "artifact_id": "beta-ai-bom",
          "media_type": "application/vnd.cyclonedx+json",
          "model_embedded_code": false,
          "model_serialization": null,
          "package_url": null,
          "remote_code_required": false,
          "role": "ai_sbom",
          "sha256": "7777777777777777777777777777777777777777777777777777777777777777"
        },
        {
          "artifact_id": "beta-container",
          "media_type": "application/vnd.oci.image.manifest.v1+json",
          "model_embedded_code": false,
          "model_serialization": null,
          "package_url": "pkg:oci/example/lureagent-beta@sha256:4444444444444444444444444444444444444444444444444444444444444444",
          "remote_code_required": false,
          "role": "container_image",